{
  "schema_version": "echo.publisher-snapshot.v1",
  "source_id": "sonyc-ust-v2",
  "record_id": "3966543",
  "record_url": "https://zenodo.org/records/3966543",
  "doi": "10.5281/zenodo.3966543",
  "release": "2.3",
  "dataset_license": "CC-BY-4.0",
  "license_model": "uniform_dataset",
  "captured_at": "2026-09-13",
  "publisher": "Zenodo",
  "evidence_scope": "Official published record identity, release metadata, file inventory and publisher MD5 checksums. Does not assert that ECHO has downloaded or verified local audio bytes.",
  "source_url": "https://zenodo.org/records/3966543",
  "files": [
    {"name":"annotations.csv","md5":"70b507b15bb4cfcce4870925302f276b","size_display":"14.5 MB"},
    {"name":"audio-0.tar.gz","md5":"bbb4dbae7d2e58e18d24878b9ee1eb51","size_display":"721.6 MB"},
    {"name":"audio-1.tar.gz","md5":"7c369ff37ac6a1fdd8493fdffe62e0a1","size_display":"721.7 MB"},
    {"name":"audio-2.tar.gz","md5":"412241c063d7f196953d3dd1c44aeb5e","size_display":"715.8 MB"},
    {"name":"audio-3.tar.gz","md5":"d2a872392d95993a2c238d305b940812","size_display":"718.6 MB"},
    {"name":"audio-4.tar.gz","md5":"b15b0e0cb3f8584259ef0d24293a9be3","size_display":"714.7 MB"},
    {"name":"audio-5.tar.gz","md5":"de745f887067433757a2f2c8f99f99bb","size_display":"719.4 MB"},
    {"name":"audio-6.tar.gz","md5":"b0286c67468369d66336f6f5ddede31f","size_display":"714.7 MB"},
    {"name":"audio-7.tar.gz","md5":"ff300183ab7a9d3f2f74c3b730ffeb52","size_display":"718.4 MB"},
    {"name":"audio-8.tar.gz","md5":"7be76b821fa6dbe20f6b50ca440e1024","size_display":"715.5 MB"},
    {"name":"audio-9.tar.gz","md5":"959f7edfbb26eadad9865069f38aa9dd","size_display":"715.3 MB"},
    {"name":"audio-10.tar.gz","md5":"84e94de273666c537a3e6b709ee88d9b","size_display":"717.7 MB"},
    {"name":"audio-11.tar.gz","md5":"44fe1f43121a7d1178aa0cdf7477793b","size_display":"719.1 MB"},
    {"name":"audio-12.tar.gz","md5":"a7eb21011f460b5ac289f8e285e875ab","size_display":"716.1 MB"},
    {"name":"audio-13.tar.gz","md5":"27945a8b1008eec787f97213164951e6","size_display":"719.9 MB"},
    {"name":"audio-14.tar.gz","md5":"fb8c7d81c3bde3a0c86c1e55e6a85a24","size_display":"713.4 MB"},
    {"name":"audio-15.tar.gz","md5":"f6af9b65d876ef96d199b9e5f0473cb9","size_display":"718.1 MB"},
    {"name":"audio-16.tar.gz","md5":"e8337c61a90c30989d500f950fbe443a","size_display":"714.2 MB"},
    {"name":"audio-17.tar.gz","md5":"3e47e85eb4564a30fe7f442ee97ec7b9","size_display":"718.9 MB"},
    {"name":"audio-18.tar.gz","md5":"c6b2ef4d0d5b7269d465c469cdbbdc4b","size_display":"365.9 MB"},
    {"name":"dcase-ust-taxonomy.yaml","md5":"6c1cca1c4c383a6ebb0cb71cb74fe3a9","size_display":"1.1 kB"},
    {"name":"README.md","md5":"bdfa3a4c0d90053f622b52afa0fc86f7","size_display":"11.3 kB"},
    {"name":"unpack_audio.sh","md5":"c78525e474d920b4b6af6385ee94bdc9","size_display":"144 B"}
  ],
  "license_evidence": {
    "per_asset_license_required": false,
    "dataset_license": "CC-BY-4.0",
    "release_safe_note": "Source-level rights profile is ALLOW with attribution; all downstream corpus integrity and semantic gates still apply."
  }
}
